{"schema_version": "gms.merge-proposal.v1", "proposal_id": "mp-0001", "proposal_version": 1, "proposal_digest": "sha256:da77795558957d1d8d7d2f614fb347de4b044bfecd6d5eab840cb86d034a00f6", "source_skill_refs": [{"schema_version": "gms.skill-artifact-ref.v1", "lineage_id": "sg-alpha", "version": 2, "kind": "step_guidance", "artifact_digest": "sha256:f0a312792f18a320fcd20e05ae9728d26979c08c10e5b872e6120946cfd55823"}, {"schema_version": "gms.skill-artifact-ref.v1", "lineage_id": "sg-beta", "version": 1, "kind": "step_guidance", "artifact_digest": "sha256:d885c42ee6d6f72fdfa50ed1be68b9f1b562b50d1dfb5a1d5e880494af9a396f"}], "similarity_assessment_refs": [{"id": "sa-0001", "version": 1, "digest": "sha256:fe7261bb45ad89c9a651146237f671418f76f6cdbf60a2cb6c722815bad0f9ae"}], "source_evidence_sets": [{"source_skill_ref": {"schema_version": "gms.skill-artifact-ref.v1", "lineage_id": "sg-alpha", "version": 2, "kind": "step_guidance", "artifact_digest": "sha256:f0a312792f18a320fcd20e05ae9728d26979c08c10e5b872e6120946cfd55823"}, "supporting_evidence_refs": [{"schema_version": "gms.evidence-ref.v1", "evidence_id": "ev-0451", "version": 2, "evidence_digest": "sha256:a2398e1b9ce01a8a29a27f65f9d0f79b47f6c5603aa60a333f24584d4d2d21fb", "commit_state": "committed", "evidence_kind": "success_path"}], "refuting_evidence_refs": [{"schema_version": "gms.evidence-ref.v1", "evidence_id": "ev-0452", "version": 1, "evidence_digest": "sha256:2daf46b3a1e1a39549aa1a7cf128969fe27bdb828b368c76cfe8f181e9b76ffc", "commit_state": "committed", "evidence_kind": "failure_path"}], "success_path_refs": [{"id": "path-alpha-success", "version": 1, "digest": "sha256:5cb58b6ec24632b99738173a34d9b4896c7349738d609c7880660f752b5880d8"}], "failure_path_refs": [{"id": "path-alpha-failure", "version": 1, "digest": "sha256:7dd8a3a35bc8826221bc430ddf462b78cf60fdb16423b74a851381c68437231c"}], "recovery_path_refs": [{"id": "path-alpha-recovery", "version": 1, "digest": "sha256:028b27ce39f8d471f8ce76a18cf6c13e1afa409ae0c9235288829f1661375ff4"}], "branch_claim_refs": [{"id": "claim-alpha-0007", "version": 1, "digest": "sha256:f5901c83bd81b3a4eea70f7d89654aa2aca5027b4921befb4fd6ab8300a8bb3b"}]}, {"source_skill_ref": {"schema_version": "gms.skill-artifact-ref.v1", "lineage_id": "sg-beta", "version": 1, "kind": "step_guidance", "artifact_digest": "sha256:d885c42ee6d6f72fdfa50ed1be68b9f1b562b50d1dfb5a1d5e880494af9a396f"}, "supporting_evidence_refs": [{"schema_version": "gms.evidence-ref.v1", "evidence_id": "ev-0453", "version": 1, "evidence_digest": "sha256:939567e48617cf2991d25bc20b76a3903bcde5d951921eb51243d1fd1bbee428", "commit_state": "committed", "evidence_kind": "recovery_path"}], "refuting_evidence_refs": [], "success_path_refs": [{"id": "path-beta-success", "version": 1, "digest": "sha256:63dbbad6a092ee1783e593165a429f82e83e9d851945a5ecebe5778bb68f7b04"}], "failure_path_refs": [{"id": "path-beta-failure", "version": 1, "digest": "sha256:a4680eb00e70a0186b175cb34115c0eb10ef88c822aa0c8c3eec98043cf39dbf"}], "recovery_path_refs": [{"id": "path-beta-recovery", "version": 1, "digest": "sha256:c72e11b99684321d4a3701ae9a294ba8557269432baebac73f885da3f11638bb"}], "branch_claim_refs": [{"id": "claim-beta-0004", "version": 1, "digest": "sha256:629f0ae7c640a11caa56cc7e5b8f7fce1d6ae1f1373dd77ae30e850a8e3a35e4"}]}], "joint_evidence": {"overlap_evidence_refs": [{"schema_version": "gms.evidence-ref.v1", "evidence_id": "ev-0460", "version": 1, "evidence_digest": "sha256:a86ec531aa86b3c07e976e7eeeca439e624b4ac80f56bf84b9353aca1c6d355a", "commit_state": "committed", "evidence_kind": "observation"}], "divergence_evidence_refs": [{"schema_version": "gms.evidence-ref.v1", "evidence_id": "ev-0461", "version": 1, "evidence_digest": "sha256:f8bc5ed91f91d4a5a85270888d4ee58e5f3aa85c8b04573c11e8dbccfca49949", "commit_state": "committed", "evidence_kind": "observation"}], "shared_anchor_refs": [{"schema_version": "gms.skill-anchor.v1", "anchor_id": "anchor-0009", "skill_ref": {"schema_version": "gms.skill-artifact-ref.v1", "lineage_id": "sg-alpha", "version": 2, "kind": "step_guidance", "artifact_digest": "sha256:f0a312792f18a320fcd20e05ae9728d26979c08c10e5b872e6120946cfd55823"}, "checkpoint_ref": {"schema_version": "host.checkpoint-ref.v1", "room_id": "room-007", "segment_ref": {"schema_version": "host.segment-ref.v1", "room_id": "room-007", "segment_id": "seg-0111", "segment_version": 2, "segment_digest": "sha256:45f2c7b93b9ce2045b496dd55f43d33f345e0427799b8373d106281f43af7dff", "evidence_seal_ref": {"id": "seal-evidence-0111", "version": 2, "digest": "sha256:654b822266ed2ab4d5865ade427b3c83d757c0128a925bf912241fdc6df45ad7"}, "path_seal_ref": {"id": "seal-path-0111", "version": 1, "digest": "sha256:73da1411cb9e2de981165003ea76bf22326ba8db6f00f4d66293ed24ce9e5259"}}, "checkpoint_id": "ckpt-0042", "checkpoint_sequence": 4, "checkpoint_digest": "sha256:a82688adfd99255746d1ea2402e214f0e3f6c673207d2f718e59774c4dd19355"}, "anchor_digest": "sha256:81a8191dc20c38cf11eb7a2f0cb4e51ce1d309fd216a05dfe2aba0523a608502", "created_from_ref": {"id": "record-anchor-0009", "version": 1, "digest": "sha256:be42e8153b23cbc3a4a550757d1d1e5f5cc7ca2b58741ee021884f8977a7f608"}}], "paired_fixture_refs": [{"id": "fixture-pair-0001", "version": 1, "digest": "sha256:4f58b785e2b89f9de7fe7cec6b92d4c741badd858331a03662abb0151c504200"}]}, "merge_intent": {"target_kind": "step_guidance", "strategy": "symmetric_new_lineage", "normalized_applicability_key": "sha256:a9dbde5056956665c8a70ab1b27104bca60a5e4958958d6b77536ccefbc9f2ed", "source_disposition": "retain", "required_branch_preservation": true}, "conflicts": [{"conflict_id": "cf-0001", "category": "contradictory_action", "semantic_location": "/body/decision_policy/branches/2/guidance", "source_a_claim_ref": {"id": "claim-alpha-0007", "version": 1, "digest": "sha256:f5901c83bd81b3a4eea70f7d89654aa2aca5027b4921befb4fd6ab8300a8bb3b"}, "source_b_claim_ref": {"id": "claim-beta-0004", "version": 1, "digest": "sha256:629f0ae7c640a11caa56cc7e5b8f7fce1d6ae1f1373dd77ae30e850a8e3a35e4"}, "applicability_overlap": "partial", "resolution": {"action": "preserve_as_branches", "evidence_refs": [{"schema_version": "gms.evidence-ref.v1", "evidence_id": "ev-0460", "version": 1, "evidence_digest": "sha256:a86ec531aa86b3c07e976e7eeeca439e624b4ac80f56bf84b9353aca1c6d355a", "commit_state": "committed", "evidence_kind": "observation"}], "rationale": "both branches retained with disjoint predicates"}, "blocking": false}], "policies": {"similarity_policy_ref": {"id": "policy.similarity.v1", "version": 1, "digest": "sha256:d4027026c022f09c2b9492bcadd80e5e943666073144c955e44511a5675ff93d"}, "merge_policy_ref": {"id": "policy.merge.v1", "version": 1, "digest": "sha256:883c236828a0b3d365f0114c78e32094f9e0b580197f81023237529c295b8df4"}, "validation_profile_ref": {"id": "profile.validation.v1", "version": 2, "digest": "sha256:7dfa34235db137627e63b370e826be242211fbc69c6c594f6a437a3115606a7a"}, "replay_profile_ref": {"id": "profile.replay.v1", "version": 1, "digest": "sha256:7ee45da76b6df7d2a302897ab29594057d95aa3893a2607c09074df302749c1c"}, "release_rule_ref": {"id": "policy.release-rule.v1", "version": 2, "digest": "sha256:97c2588ff0cd13940d0af548dabc8b19a517eb23b24cda5463910fc6ddef69f3"}, "utility_comparator_ref": {"id": "policy.utility-comparator.v1", "version": 1, "digest": "sha256:b1cc45a49b4e9d094457f30b980ab0b454290bb97e9afd5735934957d7fbffb8"}}, "dedup": {"source_pair_key": "sha256:4708aca746694f97073d4a4a9276bc471921507c32a9bfb496f8e1ca818db887", "proposal_group_key": "sha256:07e0f29cdf3d8773296515e5596f135cb2e6425a2abb3752fcb1981100365021", "intent_key": "sha256:341faab4600ee8c30798253816fd9cf6e41e2c7e5dae8ed88c8ce94e2249d351"}, "origin": {"initiator_type": "model", "initiator_ref": "model://primary", "request_ref": "req-0042"}, "prior_proposal_refs": []}
